{
  "name": "base-yield-trade",
  "description": "To add 'trade' yields to the tiles as per the original Civilization.",
  "version": "0.0.1",
  "dependencies": [
    "base-terrain",
    "base-terrain-improvements",
    "core-rules",
    "core-yields"
  ],
  "components": [
    {
      "type": "script",
      "file": "Yields/Trade.js"
    },
    {
      "type": "script",
      "file": "Rules/Yields/Desert.js"
    },
    {
      "type": "script",
      "file": "Rules/Yields/Grassland.js"
    },
    {
      "type": "script",
      "file": "Rules/Yields/Ocean.js"
    },
    {
      "type": "script",
      "file": "Rules/Yields/Plains.js"
    },
    {
      "type": "script",
      "file": "Rules/Yields/River.js"
    },
    {
      "type": "script",
      "file": "register.js"
    }
  ]
}