{
  "name": "base-city-improvement-courthouse",
  "version": "0.1.0",
  "dependencies": [
    "base-city",
    "base-city-improvement-palace",
    "base-city-improvements",
    "base-currency",
    "core-city-improvement",
    "core-rules",
    "core-registry",
    "core-rules-registry"
  ],
  "components": [
    {
      "type": "script",
      "file": "registerAvailableCityBuildItem.js"
    },
    {
      "type": "script",
      "file": "Rules/City/build-cost.js"
    },
    {
      "type": "script",
      "file": "Rules/City/cost.js"
    },
    {
      "type": "script",
      "file": "Rules/City/build.js"
    },
    {
      "type": "script",
      "file": "registerRules.js"
    },
    {
      "type": "script",
      "file": "Courthouse.js"
    }
  ]
}