{
  "name": "base-wonder",
  "version": "0.1.0",
  "dependencies": [
    "core-rules",
    "core-wonder",
    "base-city",
    "base-city-happiness",
    "base-science",
    "base-terrain-yield-trade",
    "base-unit",
    "core-city-improvement",
    "core-unit",
    "base-city-improvements-civ1"
  ],
  "components": [
    {
      "type": "script",
      "file": "Wonders/Oracle.js"
    },
    {
      "type": "script",
      "file": "Wonders/HangingGardens.js"
    },
    {
      "type": "script",
      "file": "Wonders/GreatWall.js"
    },
    {
      "type": "script",
      "file": "Wonders/Pyramids.js"
    },
    {
      "type": "script",
      "file": "Wonders/GreatLibrary.js"
    },
    {
      "type": "script",
      "file": "Wonders/CopernicusObservatory.js"
    },
    {
      "type": "script",
      "file": "Wonders/Colossus.js"
    },
    {
      "type": "script",
      "file": "Wonders/Lighthouse.js"
    },
    {
      "type": "script",
      "file": "Wonders/MagellansExpedition.js"
    },
    {
      "type": "script",
      "file": "Wonders.js"
    },
    {
      "type": "script",
      "file": "Rules/City/build-cost.js"
    },
    {
      "type": "script",
      "file": "Rules/City/build.js"
    },
    {
      "type": "script",
      "file": "registerWonders.js"
    },
    {
      "type": "script",
      "file": "Rules/City/building-complete.js"
    },
    {
      "type": "script",
      "file": "registerRules.js"
    },
    {
      "type": "script",
      "file": "Rules/Unit/yield.js"
    },
    {
      "type": "script",
      "file": "Rules/Player/research-complete.js"
    },
    {
      "type": "script",
      "file": "Rules/City/yield.js"
    }
  ]
}