{
  "name": "base-player-science",
  "description": "A bridge for players to allow and control researching advances.",
  "dependencies": [
    "base-science",
    "core-player",
    "core-registry",
    "core-rules",
    "core-science"
  ],
  "components": [
    {
      "type": "script",
      "file": "PlayerResearchRegistry.js"
    },
    {
      "type": "script",
      "file": "PlayerResearch.js"
    },
    {
      "type": "script",
      "file": "Events/Player/yield.js"
    },
    {
      "type": "script",
      "file": "Events/Player/added.js"
    },
    {
      "type": "script",
      "file": "Events/Game/start.js"
    },
    {
      "type": "script",
      "file": "Events/City/yield.js"
    }
  ]
}