{
  "name": "base-unit-actions",
  "version": "0.1.0",
  "dependencies": [
    "base-terrain",
    "base-unit",
    "base-unit-improvements",
    "core-city",
    "core-rules",
    "core-terrain",
    "core-unit",
    "core-unit-actions",
    "base-tile-improvements",
    "core-tile-improvements"
  ],
  "components": [
    {
      "type": "script",
      "file": "Action/Attack.js"
    },
    {
      "type": "script",
      "file": "Action/CaptureCity.js"
    },
    {
      "type": "script",
      "file": "Action/BoardTransport.js"
    },
    {
      "type": "script",
      "file": "Action/BuildIrrigation.js"
    },
    {
      "type": "script",
      "file": "Action/BuildMine.js"
    },
    {
      "type": "script",
      "file": "Action/BuildRoad.js"
    },
    {
      "type": "script",
      "file": "Action/DelayedAction.js"
    },
    {
      "type": "script",
      "file": "Action/Fortify.js"
    },
    {
      "type": "script",
      "file": "Action/FoundCity.js"
    },
    {
      "type": "script",
      "file": "Action/Move.js"
    },
    {
      "type": "script",
      "file": "Action/NoOrders.js"
    },
    {
      "type": "script",
      "file": "Actions.js"
    },
    {
      "type": "script",
      "file": "register.js"
    },
    {
      "type": "script",
      "file": "Rules/Unit/action.js"
    }
  ]
}